{
  "schema": "date-experiment-run-v1",
  "run_id": "20260905_203649_cmr_descal_prop1024_gls",
  "status": "fail",
  "design_id": "PROP1024",
  "benchmark_id": null,
  "seed": 900001,
  "adapter": "network_sdf",
  "git": {
    "sha": "3632e4fbb27ac6d4e6c60dccf7871d4d4dfa6511",
    "dirty": true,
    "describe": "3632e4f-dirty"
  },
  "config_hash": "793697d37e6e447c258c3299383ade1edf856b6ef6627aadefb04a4b3ea4e9d5",
  "case_hash": null,
  "trace_hash": null,
  "netlist_hash": "95cf375cd928d7fbcd1c64135bcadcab73b8c8a3107496f25bb030aa4b0ca03c",
  "sdf_hash": "27b51b39364f2cef7503e86cc66de4fe135ff9bd26117e5605d5b86ce01047b7",
  "spef_hash": null,
  "model_version": null,
  "calibration_hash": null,
  "tool_versions": {},
  "pvt": {
    "library": "tcbn28hpcplusbwp12t30p140",
    "corner": "ssg0p81v125c",
    "wireload": "zero"
  },
  "command": [
    "python",
    "scripts/asic_dc/cmr/import_signed_prop1024.py"
  ],
  "env": {
    "CMR_DESCAL": "1",
    "CMR_NETWORK_NETLIST_RUN_ID": "20260905_003827_cmr_descal_prop1024",
    "NETLIST_RUN_ID": "20260905_003827_cmr_descal_prop1024"
  },
  "lsf_jobs": [],
  "frozen_structure_ok": true,
  "paper_eligible": false,
  "physical_class": "post-synthesis",
  "archive_only_reason": "SDF scoreboard incomplete on mixed-delay PROP1024 netlist",
  "remote_root": "/home/ghy19/Asynchronous_Router_CMR",
  "artifacts": {
    "netlist_run_id": "20260905_003827_cmr_descal_prop1024",
    "gls_run_ids": [
      "20260905_203649_cmr_descal_prop1024_gls"
    ],
    "skip_dc": true,
    "delay_recipe": "tree RCU 1xDEL050 + TopMesh RCU 1xDEL150 / Ackin 1xDEL050",
    "dc_mark": [
      "CMR_HIER_STITCH_COUNTS router=0 expected_r=352 ipm=2496 opm=2496 expected_p=2496 DEL050=2336/2336 DEL150=160/160 DEL250=0/0 unit=50",
      "CMR_NETWORK_DC_PASS output=/home/ghy19/Asynchronous_Router_CMR/outputs/20260905_003827_cmr_descal_prop1024 top=NoC_1024nodes routers=0 ipm=2496 adapters=4864 fifos=0"
    ],
    "sdf_cases": {
      "directed": {
        "tb_pass": true,
        "annotation_done": true,
        "annotation_errors": 0,
        "timing_violation_count": 0,
        "unexpected_failure": false,
        "stall_failure": false,
        "x_failure": false,
        "ifnsdfa": false,
        "result_line": "TB_RESULT PASS injected=80 delivered=80 missing=0 unexpected=0 timeout=0 drainable=1",
        "missing_log": false,
        "case": "KEY-1024_n1024_s900001_zero_PROP1024_top0",
        "gls_run_id": "20260905_203649_cmr_descal_prop1024_gls"
      },
      "zero": {
        "tb_pass": true,
        "annotation_done": true,
        "annotation_errors": 0,
        "timing_violation_count": 0,
        "unexpected_failure": false,
        "stall_failure": false,
        "x_failure": false,
        "ifnsdfa": false,
        "result_line": "TB_RESULT PASS injected=60 delivered=60 missing=0 unexpected=0 timeout=0 drainable=1",
        "missing_log": false,
        "case": "TOPO-UR_n1024_s900001_zero_PROP1024_top0",
        "gls_run_id": "20260905_203649_cmr_descal_prop1024_gls"
      },
      "low": {
        "tb_pass": true,
        "annotation_done": true,
        "annotation_errors": 0,
        "timing_violation_count": 0,
        "unexpected_failure": false,
        "stall_failure": false,
        "x_failure": false,
        "ifnsdfa": false,
        "result_line": "TB_RESULT PASS injected=60 delivered=60 missing=0 unexpected=0 timeout=0 drainable=1",
        "missing_log": false,
        "case": "TOPO-UR_n1024_s900001_r0p05_PROP1024_top0",
        "gls_run_id": "20260905_203649_cmr_descal_prop1024_gls"
      },
      "medium": {
        "tb_pass": true,
        "annotation_done": true,
        "annotation_errors": 0,
        "timing_violation_count": 0,
        "unexpected_failure": false,
        "stall_failure": false,
        "x_failure": false,
        "ifnsdfa": false,
        "result_line": "TB_RESULT PASS injected=60 delivered=60 missing=0 unexpected=0 timeout=0 drainable=1",
        "missing_log": false,
        "case": "TOPO-UR_n1024_s900001_r0p10_PROP1024_top0",
        "gls_run_id": "20260905_203649_cmr_descal_prop1024_gls"
      },
      "near-sat": {
        "tb_pass": true,
        "annotation_done": true,
        "annotation_errors": 0,
        "timing_violation_count": 0,
        "unexpected_failure": false,
        "stall_failure": false,
        "x_failure": false,
        "ifnsdfa": false,
        "result_line": "TB_RESULT PASS injected=60 delivered=60 missing=0 unexpected=0 timeout=0 drainable=1",
        "missing_log": false,
        "case": "TOPO-UR_n1024_s900001_r0p30_PROP1024_top0",
        "gls_run_id": "20260905_203649_cmr_descal_prop1024_gls"
      },
      "multicast": {
        "tb_pass": false,
        "annotation_done": true,
        "annotation_errors": 0,
        "timing_violation_count": 0,
        "unexpected_failure": false,
        "stall_failure": false,
        "x_failure": false,
        "ifnsdfa": false,
        "result_line": "TB_RESULT FAIL injected=80 delivered=1230 missing=0 unexpected=1145 timeout=0 drainable=0",
        "missing_log": false,
        "case": "MC-UR_n1024_s900001_r0p10_PROP1024_top0",
        "gls_run_id": "20260905_203649_cmr_descal_prop1024_gls"
      }
    },
    "case_hashes": {},
    "traffic": "KEY-1024 + TOPO-UR zero/0.05/0.10/0.30 + MC-UR 0.10 seed 900001 5-flit",
    "paper_matrix_allowed": false
  },
  "cases": [],
  "created_utc": "2026-09-05T14:07:36+00:00",
  "updated_utc": "2026-09-05T14:07:36+00:00",
  "notes": "PROP1024 mixed-delay netlist 20260905_003827_cmr_descal_prop1024 was hashed, but required MAXIMUM-SDF cases are not all clean. Keep paper_eligible=false."
}
