{
  "schema": "date-experiment-run-v1",
  "run_id": "20260912_205700_cmr_flatmesh_c1p1_rpsdel050",
  "status": "pass",
  "design_id": "ASYNC_FLATMESH_1X1",
  "benchmark_id": "R-U5",
  "seed": null,
  "adapter": "dc_cmr_router",
  "git": {
    "sha": "385e40e68387136ab902660256750570d55cb9b1",
    "dirty": true,
    "describe": "385e40e-dirty"
  },
  "config_hash": "5dfbc38560f754c382ecdb3e27d0ecaa2af1e0ba5111e7a75bbbd7a41c82b410",
  "case_hash": null,
  "trace_hash": null,
  "netlist_hash": "50b932ad0e3dd963955676933be0bb7a755a92e3277c78845eea53727bcb6c2e",
  "sdf_hash": null,
  "spef_hash": null,
  "model_version": null,
  "calibration_hash": null,
  "tool_versions": {},
  "pvt": {
    "library": "tcbn28hpcplusbwp12t30p140",
    "corner": "ssg0p81v125c",
    "wireload": "zero"
  },
  "command": [],
  "env": {},
  "lsf_jobs": [],
  "frozen_structure_ok": true,
  "paper_eligible": true,
  "physical_class": "post-synthesis",
  "archive_only_reason": null,
  "remote_root": "/home/ghy19/Asynchronous_Router_CMR",
  "artifacts": {
    "local_dc": "D:/NoC/asynchronous_fat_tree_multicast/scripts/asic_dc/cmr/results/20260912_205700_cmr_flatmesh_c1p1_rpsdel050",
    "hop_ppa": "D:/NoC/asynchronous_fat_tree_multicast/scripts/asic_dc/cmr/results/20260912_205700_cmr_primitive_hop_ppa_rpsdel050",
    "metrics_csv": "D:/NoC/asynchronous_fat_tree_multicast/scripts/asic_dc/cmr/results/20260912_205700_cmr_primitive_hop_ppa_rpsdel050/metrics.csv",
    "kind": "async_flatmesh_1x1",
    "area_um2": 7273.22395,
    "head_ns": "0.709",
    "max_opm_fanin": 4
  },
  "cases": [],
  "created_utc": "2026-09-12T15:32:17+00:00",
  "updated_utc": "2026-09-12T15:32:17+00:00",
  "notes": "DATE V3 Phase 2 post-synthesis primitive DC + R-U5 hop PPA. No P&R."
}
