{
  "schema": "date-experiment-run-v1",
  "run_id": "20260901_cmr_sync_prop_2x2_1p0ns",
  "status": "pass",
  "design_id": "SYNC_PROP_2X2",
  "benchmark_id": "R-U5",
  "seed": null,
  "adapter": "dc_sync_router",
  "git": {
    "sha": "507b6f1230bba0a51c7cc9a64eea820cd4549138",
    "dirty": true,
    "describe": "507b6f1-dirty"
  },
  "config_hash": "b7fa96549b322aa3ca26d7c00074b27db3e204f619054feefbf4c13d2ee6c545",
  "case_hash": null,
  "trace_hash": null,
  "netlist_hash": "3a5317bcde60174082d2f12e30a960b27b538cfb96f959c4af1b5a984a341f67",
  "sdf_hash": "63ab7f7b43ecb162dcd6e263f0c0d64b4ded9aed9d163d7fd2edf9a8043592be",
  "spef_hash": null,
  "model_version": null,
  "calibration_hash": "4385f8b70c2e69f69589025557458cf1c205f926c8382910e2714bc86bbe62df",
  "tool_versions": {},
  "pvt": {
    "library": "tcbn28hpcplusbwp12t30p140",
    "corner": "ssg0p81v125c",
    "wireload": "zero"
  },
  "command": [],
  "env": {},
  "lsf_jobs": [],
  "frozen_structure_ok": true,
  "paper_eligible": true,
  "physical_class": "post-synthesis",
  "archive_only_reason": null,
  "remote_root": "/home/ghy19/Asynchronous_Router_CMR",
  "artifacts": {
    "local_dc": "d:/NoC/asynchronous_fat_tree_multicast/scripts/asic_dc/cmr/results/20260901_cmr_sync_prop_2x2_1p0ns",
    "hop_ppa": "d:/NoC/asynchronous_fat_tree_multicast/scripts/asic_dc/cmr/results/20260901_cmr_primitive_hop_ppa_ru5",
    "metrics_csv": "d:/NoC/asynchronous_fat_tree_multicast/scripts/asic_dc/cmr/results/20260901_cmr_primitive_hop_ppa_ru5/metrics.csv",
    "kind": "sync_prop_2x2",
    "area_um2": 15734.711836,
    "head_ns": "1.000",
    "wns_ns": 0.00261784,
    "max_opm_fanin": 8
  },
  "cases": [],
  "created_utc": "2026-08-31T16:54:59+00:00",
  "updated_utc": "2026-08-31T16:54:59+00:00",
  "notes": "DATE V3 Phase 2.5 Sync 1-cycle Head post-synthesis DC + R-U5 hop PPA. No P&R."
}
