{
  "schema": "date-experiment-run-v1",
  "run_id": "20260912_205700_cmr_pfat_l3_c4p8_rpsdel050",
  "status": "pass",
  "design_id": "ASYNC_PFAT_4X8",
  "benchmark_id": "R-U5",
  "seed": null,
  "adapter": "dc_cmr_router",
  "git": {
    "sha": "385e40e68387136ab902660256750570d55cb9b1",
    "dirty": true,
    "describe": "385e40e-dirty"
  },
  "config_hash": "db438a8dceee1f85104c85313e734ffc4a229c13b8977f6b4f3bc5bf1fb4d71e",
  "case_hash": null,
  "trace_hash": null,
  "netlist_hash": "09bb891ba2731262b7cad7f803fff0a35fcfb049f9071d3830558de847a14747",
  "sdf_hash": null,
  "spef_hash": null,
  "model_version": null,
  "calibration_hash": null,
  "tool_versions": {},
  "pvt": {
    "library": "tcbn28hpcplusbwp12t30p140",
    "corner": "ssg0p81v125c",
    "wireload": "zero"
  },
  "command": [],
  "env": {},
  "lsf_jobs": [],
  "frozen_structure_ok": true,
  "paper_eligible": true,
  "physical_class": "post-synthesis",
  "archive_only_reason": null,
  "remote_root": "/home/ghy19/Asynchronous_Router_CMR",
  "artifacts": {
    "local_dc": "D:/NoC/asynchronous_fat_tree_multicast/scripts/asic_dc/cmr/results/20260912_205700_cmr_pfat_l3_c4p8_rpsdel050",
    "hop_ppa": "D:/NoC/asynchronous_fat_tree_multicast/scripts/asic_dc/cmr/results/20260912_205700_cmr_primitive_hop_ppa_rpsdel050",
    "metrics_csv": "D:/NoC/asynchronous_fat_tree_multicast/scripts/asic_dc/cmr/results/20260912_205700_cmr_primitive_hop_ppa_rpsdel050/metrics.csv",
    "kind": "async_pfat_4x8",
    "area_um2": 61187.279351,
    "head_ns": "1.584",
    "max_opm_fanin": 20
  },
  "cases": [],
  "created_utc": "2026-09-12T15:32:19+00:00",
  "updated_utc": "2026-09-12T15:32:19+00:00",
  "notes": "DATE V3 Phase 2 post-synthesis primitive DC + R-U5 hop PPA. No P&R."
}
