{
  "schema": "date-experiment-run-v1",
  "run_id": "20260903_101701_cmr_descal_fm64_del100",
  "status": "fail",
  "design_id": "FM64",
  "benchmark_id": null,
  "seed": 900001,
  "adapter": "network_sdf",
  "git": {
    "sha": "3632e4fbb27ac6d4e6c60dccf7871d4d4dfa6511",
    "dirty": true,
    "describe": "3632e4f-dirty"
  },
  "config_hash": "ca1d418a37630b8aff5250d3fb0017023207bd909eeb1279c0d84717e5e2b45c",
  "case_hash": null,
  "trace_hash": null,
  "netlist_hash": "d9b858648724e92a68a08e25a2544a9fc9aad235c23eaf1399098b5b53503668",
  "sdf_hash": "05c0a9da8d6c503e5c426c00ac8e3872562c170e5595887a9180929b7f35ddab",
  "spef_hash": null,
  "model_version": null,
  "calibration_hash": null,
  "tool_versions": {},
  "pvt": {
    "library": "tcbn28hpcplusbwp12t30p140",
    "corner": "ssg0p81v125c",
    "wireload": "zero"
  },
  "command": [
    "python",
    "scripts/asic_dc/cmr/import_signed_fm64_del100.py"
  ],
  "env": {
    "CMR_RCU_MATCHED_DELAY_UNIT_PS": "100",
    "CMR_OPM_ACKIN_DELAY_UNIT_PS": "50",
    "NETLIST_RUN_ID": "20260903_101701_cmr_descal_fm64_del100"
  },
  "lsf_jobs": [],
  "frozen_structure_ok": true,
  "paper_eligible": false,
  "physical_class": "post-synthesis",
  "archive_only_reason": "RCU 1xDEL100 trial. Isolation passed; KEY/UR dropped one packet. Paper mesh baseline is 1xDEL150.",
  "remote_root": "/home/ghy19/Asynchronous_Router_CMR",
  "artifacts": {
    "netlist_run_id": "20260903_101701_cmr_descal_fm64_del100",
    "delay_recipe": "RCU 1xDEL100 / Ackin 1xDEL050",
    "sdf_cases": {
      "directed": {
        "tb_pass": false,
        "annotation_done": true,
        "annotation_errors": 0,
        "timing_violation_count": 0,
        "unexpected_failure": false,
        "stall_failure": true,
        "result_line": "TB_RESULT FAIL injected=100 delivered=95 missing=5 unexpected=0 timeout=0 inject_max_rate=0 elapsed_ns=150000.000 flits_per_ns=0.000633",
        "case": "KEY-64_n64_s900001_zero_FM64_top0"
      },
      "zero": {
        "tb_pass": false,
        "annotation_done": true,
        "annotation_errors": 0,
        "timing_violation_count": 0,
        "unexpected_failure": false,
        "stall_failure": true,
        "result_line": "TB_RESULT FAIL injected=59 delivered=55 missing=5 unexpected=0 timeout=0 inject_max_rate=0 elapsed_ns=108000.000 flits_per_ns=0.000509",
        "case": "TOPO-UR_n64_s900001_zero_FM64_top0"
      },
      "medium": {
        "tb_pass": false,
        "annotation_done": true,
        "annotation_errors": 0,
        "timing_violation_count": 0,
        "unexpected_failure": false,
        "stall_failure": true,
        "result_line": "TB_RESULT FAIL injected=59 delivered=55 missing=5 unexpected=0 timeout=0 inject_max_rate=0 elapsed_ns=55000.000 flits_per_ns=0.001000",
        "case": "TOPO-UR_n64_s900001_r0p10_FM64_top0"
      },
      "iso-6to44": {
        "tb_pass": true,
        "annotation_done": true,
        "annotation_errors": 0,
        "timing_violation_count": 0,
        "unexpected_failure": false,
        "stall_failure": false,
        "result_line": "TB_RESULT PASS injected=5 delivered=5 missing=0 unexpected=0 timeout=0 inject_max_rate=0 elapsed_ns=20563.603 flits_per_ns=0.000243",
        "case": "DBG-64_fm64_6to44"
      },
      "iso-body0": {
        "tb_pass": true,
        "annotation_done": true,
        "annotation_errors": 0,
        "timing_violation_count": 0,
        "unexpected_failure": false,
        "stall_failure": false,
        "result_line": "TB_RESULT PASS injected=5 delivered=5 missing=0 unexpected=0 timeout=0 inject_max_rate=0 elapsed_ns=20563.603 flits_per_ns=0.000243",
        "case": "DBG-64_fm64_6to44_body0"
      }
    },
    "dc_mark": [
      "ModuleCmd_Load.c(213):ERROR:105: Unable to locate a modulefile for 'INVS211'",
      "ModuleCmd_Load.c(213):ERROR:105: Unable to locate a modulefile for 'IC618'",
      "ModuleCmd_Load.c(213):ERROR:105: Unable to locate a modulefile for 'QUANTUS23.1'"
    ],
    "traffic": "KEY-64 directed + TOPO-UR zero/0.10 + isolation 6to44 seed 900001 5-flit",
    "paper_matrix_allowed": false
  },
  "cases": [],
  "created_utc": "2026-09-03T07:47:26+00:00",
  "updated_utc": "2026-09-03T07:47:26+00:00",
  "notes": "Archive: 64-node asynchronous flat mesh at RCU 1xDEL100 / Ackin 1xDEL050. Isolation 6to44 passed; KEY-64 / TOPO-UR missing one 5-flit packet. Paper baseline is 20260903_101701_cmr_descal_fm64_del150. Do not overwrite."
}
