{
  "schema": "date-experiment-run-v1",
  "run_id": "20260830_cmr_fat_l2_hop_del050_ackin050",
  "status": "imported_readonly",
  "design_id": "ASYNC_PROP_2X2",
  "benchmark_id": "R-U5",
  "seed": null,
  "adapter": "import_readonly",
  "git": {
    "sha": "04f0e55135c59894532624a9b87e9434bf94091e",
    "dirty": true,
    "describe": "04f0e55-dirty"
  },
  "config_hash": "48c34384ee22d1a7d633ede9a704455e5d320fac4c072f2b009ff85ba42cb522",
  "case_hash": null,
  "trace_hash": null,
  "netlist_hash": null,
  "sdf_hash": null,
  "spef_hash": null,
  "model_version": null,
  "calibration_hash": null,
  "tool_versions": {},
  "pvt": {
    "library": "tcbn28hpcplusbwp12t30p140",
    "corner": "ssg0p81v125c",
    "wireload": "zero"
  },
  "command": [
    "import_readonly"
  ],
  "env": {},
  "lsf_jobs": [],
  "frozen_structure_ok": null,
  "paper_eligible": false,
  "physical_class": "post-synthesis",
  "archive_only_reason": null,
  "remote_root": "/home/ghy19/Asynchronous_Router_CMR",
  "artifacts": {},
  "cases": [],
  "created_utc": "2026-08-31T05:50:00+00:00",
  "updated_utc": "2026-08-31T05:50:00+00:00",
  "notes": "PROP L2 hop MAXIMUM SDF; paper-eligible as post-synthesis calibrated hop (DATE V3 does not replace with post-route)."
}
