{
  "schema": "date-experiment-run-v1",
  "run_id": "20260831_014622_cmr_sync_noc64_thin_p50",
  "status": "imported_readonly",
  "design_id": "SYNC_THIN_1X1",
  "benchmark_id": null,
  "seed": null,
  "adapter": "import_readonly",
  "git": {
    "sha": "04f0e55135c59894532624a9b87e9434bf94091e",
    "dirty": true,
    "describe": "04f0e55-dirty"
  },
  "config_hash": "dc9518b1460d83c12331802d0a02198484ca92ba1bf51b631ea90b97bf745c06",
  "case_hash": null,
  "trace_hash": null,
  "netlist_hash": null,
  "sdf_hash": null,
  "spef_hash": null,
  "model_version": null,
  "calibration_hash": null,
  "tool_versions": {},
  "pvt": {
    "library": "tcbn28hpcplusbwp12t30p140",
    "corner": "ssg0p81v125c",
    "wireload": "zero"
  },
  "command": [
    "import_readonly"
  ],
  "env": {},
  "lsf_jobs": [],
  "frozen_structure_ok": null,
  "paper_eligible": false,
  "physical_class": "post-synthesis",
  "archive_only_reason": null,
  "remote_root": "/home/ghy19/Asynchronous_Router_CMR",
  "artifacts": {},
  "cases": [],
  "created_utc": "2026-08-31T05:50:01+00:00",
  "updated_utc": "2026-08-31T05:50:01+00:00",
  "notes": "Clocked Thin SyncNoC64 1.0 ns SS ZeroWireload."
}
