{
  "schema": "date-experiment-run-v1",
  "run_id": "20260828_cmr_cfifo_tp_nogrant_p50",
  "status": "imported_readonly",
  "design_id": "THIN64",
  "benchmark_id": null,
  "seed": null,
  "adapter": "import_readonly",
  "git": {
    "sha": "04f0e55135c59894532624a9b87e9434bf94091e",
    "dirty": true,
    "describe": "04f0e55-dirty"
  },
  "config_hash": "bb90fd2d0942ee0a4a68287f8508e6361d1827d7c431f6c9520578bc0b2915b5",
  "case_hash": null,
  "trace_hash": null,
  "netlist_hash": null,
  "sdf_hash": null,
  "spef_hash": null,
  "model_version": null,
  "calibration_hash": null,
  "tool_versions": {},
  "pvt": {
    "library": "tcbn28hpcplusbwp12t30p140",
    "corner": "ssg0p81v125c",
    "wireload": null
  },
  "command": [
    "import_readonly"
  ],
  "env": {},
  "lsf_jobs": [],
  "frozen_structure_ok": null,
  "paper_eligible": false,
  "physical_class": "archive-only",
  "archive_only_reason": "Thin NoC16 CFifo with RCU matched BUFFD0. Archive-only.",
  "remote_root": "/home/ghy19/Asynchronous_Router_CMR",
  "artifacts": {},
  "cases": [],
  "created_utc": "2026-08-31T05:50:03+00:00",
  "updated_utc": "2026-08-31T05:50:03+00:00",
  "notes": "CFifo/BUFFD0 laboratory netlist."
}
