{
  "schema": "date-experiment-run-v1",
  "run_id": "20260831_cmr_sync_prop_2x2_1p0ns",
  "status": "pass",
  "design_id": "SYNC_PROP_2X2",
  "benchmark_id": "R-U5",
  "seed": null,
  "adapter": "dc_sync_router",
  "git": {
    "sha": "507b6f1230bba0a51c7cc9a64eea820cd4549138",
    "dirty": true,
    "describe": "507b6f1-dirty"
  },
  "config_hash": "b7fa96549b322aa3ca26d7c00074b27db3e204f619054feefbf4c13d2ee6c545",
  "case_hash": null,
  "trace_hash": null,
  "netlist_hash": "0940ac5b817380370da7a02c10b46266d5d61a7cdf50ae1ccb1a9f35f0b6e464",
  "sdf_hash": null,
  "spef_hash": null,
  "model_version": null,
  "calibration_hash": null,
  "tool_versions": {},
  "pvt": {
    "library": "tcbn28hpcplusbwp12t30p140",
    "corner": "ssg0p81v125c",
    "wireload": "zero"
  },
  "command": [],
  "env": {},
  "lsf_jobs": [],
  "frozen_structure_ok": true,
  "paper_eligible": false,
  "physical_class": "archive-only",
  "archive_only_reason": "Phase 2 Sync hop with 3-cycle Head. Replaced by Phase 2.5 1-cycle Head.",
  "remote_root": "/home/ghy19/Asynchronous_Router_CMR",
  "artifacts": {
    "local_dc": "D:/NoC/asynchronous_fat_tree_multicast/scripts/asic_dc/cmr/results/20260831_cmr_sync_prop_2x2_1p0ns",
    "hop_ppa": "D:/NoC/asynchronous_fat_tree_multicast/scripts/asic_dc/cmr/results/20260831_cmr_primitive_hop_ppa_ru5",
    "metrics_csv": "D:/NoC/asynchronous_fat_tree_multicast/scripts/asic_dc/cmr/results/20260831_cmr_primitive_hop_ppa_ru5/metrics.csv",
    "kind": "sync_prop_2x2",
    "area_um2": 15469.943816,
    "head_ns": "3.000",
    "max_opm_fanin": 8
  },
  "cases": [],
  "created_utc": "2026-08-31T15:52:40+00:00",
  "updated_utc": "2026-08-31T15:52:40+00:00",
  "notes": "DATE V3 Phase 2 post-synthesis primitive DC + R-U5 hop PPA. No P&R."
}
