{
  "schema": "date-experiment-run-v1",
  "run_id": "20260830_095259_cmr_noc64_p50_1222",
  "status": "imported_readonly",
  "design_id": "PROP64",
  "benchmark_id": null,
  "seed": null,
  "adapter": "import_readonly",
  "git": {
    "sha": "04f0e55135c59894532624a9b87e9434bf94091e",
    "dirty": true,
    "describe": "04f0e55-dirty"
  },
  "config_hash": "1c07c8941271eb9d4fe726a96b03b55725a1983c6552b3e986e3075184d5cb21",
  "case_hash": null,
  "trace_hash": null,
  "netlist_hash": null,
  "sdf_hash": null,
  "spef_hash": null,
  "model_version": null,
  "calibration_hash": null,
  "tool_versions": {},
  "pvt": {
    "library": "tcbn28hpcplusbwp12t30p140",
    "corner": "ssg0p81v125c",
    "wireload": null
  },
  "command": [
    "import_readonly"
  ],
  "env": {},
  "lsf_jobs": [],
  "frozen_structure_ok": null,
  "paper_eligible": false,
  "physical_class": "archive-only",
  "archive_only_reason": "Ackin DEL250 predecessor. Not the hop delay recipe. Archive-only.",
  "remote_root": "/home/ghy19/Asynchronous_Router_CMR",
  "artifacts": {},
  "cases": [],
  "created_utc": "2026-08-31T05:50:03+00:00",
  "updated_utc": "2026-08-31T05:50:03+00:00",
  "notes": "Must not enter curated or Table I/Fig A delay comparison."
}
