{
  "schema": "date-experiment-run-v1",
  "run_id": "20260912_205700_cmr_topmesh_c2p2_rpsdel050",
  "status": "pass",
  "design_id": "ASYNC_TOPMESH_2X2",
  "benchmark_id": "R-U5",
  "seed": null,
  "adapter": "dc_cmr_router",
  "git": {
    "sha": "385e40e68387136ab902660256750570d55cb9b1",
    "dirty": true,
    "describe": "385e40e-dirty"
  },
  "config_hash": "31f7981b1c99711fc52de99e2ec192f143c03778af2f7783b30e6cd5f3fa0029",
  "case_hash": null,
  "trace_hash": null,
  "netlist_hash": "72c7e08d269dbf4a8b500b57b51058a3db2a4e58634df23d556886efcb2f3f1d",
  "sdf_hash": null,
  "spef_hash": null,
  "model_version": null,
  "calibration_hash": null,
  "tool_versions": {},
  "pvt": {
    "library": "tcbn28hpcplusbwp12t30p140",
    "corner": "ssg0p81v125c",
    "wireload": "zero"
  },
  "command": [],
  "env": {},
  "lsf_jobs": [],
  "frozen_structure_ok": true,
  "paper_eligible": true,
  "physical_class": "post-synthesis",
  "archive_only_reason": null,
  "remote_root": "/home/ghy19/Asynchronous_Router_CMR",
  "artifacts": {
    "local_dc": "D:/NoC/asynchronous_fat_tree_multicast/scripts/asic_dc/cmr/results/20260912_205700_cmr_topmesh_c2p2_rpsdel050",
    "hop_ppa": "D:/NoC/asynchronous_fat_tree_multicast/scripts/asic_dc/cmr/results/20260912_205700_cmr_primitive_hop_ppa_rpsdel050",
    "metrics_csv": "D:/NoC/asynchronous_fat_tree_multicast/scripts/asic_dc/cmr/results/20260912_205700_cmr_primitive_hop_ppa_rpsdel050/metrics.csv",
    "kind": "async_topmesh_2x2",
    "area_um2": 18129.887845,
    "head_ns": "1.193",
    "max_opm_fanin": 8
  },
  "cases": [],
  "created_utc": "2026-09-12T15:32:19+00:00",
  "updated_utc": "2026-09-12T15:32:19+00:00",
  "notes": "DATE V3 Phase 2 post-synthesis primitive DC + R-U5 hop PPA. No P&R."
}
